{
  "id": "2026-11-11-bananas-are-radioactive",
  "topic": "science",
  "title": "Every Banana You Eat Is Radioactive (Here's the Math)",
  "scenes": [
    {
      "text": "Every banana you've ever eaten was radioactive.",
      "keywords": "banana bunch yellow closeup"
    },
    {
      "text": "Bananas are packed with potassium. And a tiny fraction of all potassium on Earth is potassium forty, a radioactive form as old as the planet.",
      "keywords": "geiger counter radiation detector"
    },
    {
      "text": "One banana gives you about a tenth of a microsievert. Physicists even have a unit for it. The banana equivalent dose.",
      "keywords": "scientist laboratory measuring"
    },
    {
      "text": "A whole truckload of bananas can set off the radiation alarms at shipping ports that hunt for smuggled nuclear material.",
      "keywords": "cargo truck shipping port containers"
    },
    {
      "text": "It's harmless because your body already holds far more potassium forty than a banana does. You are more radioactive than your lunch.",
      "keywords": "person eating banana outdoors"
    },
    {
      "text": "To get a dangerous dose, you'd have to eat roughly thirty-five million bananas at once. How many have you eaten so far?",
      "keywords": "banana plantation harvest pile"
    }
  ],
  "description": "Every banana you have ever eaten was slightly radioactive.\nBananas are rich in potassium, and a tiny fraction of natural potassium is radioactive potassium-40. One banana delivers about 0.1 microsieverts, a unit physicists jokingly call the banana equivalent dose. A truckload can trip the radiation monitors at shipping ports.\nIt is harmless: your own body holds far more potassium-40 than a banana, and a dangerous dose would take around 35 million bananas at once.\nHow many bananas have you eaten in your life?",
  "tags": [
    "bananas radioactive",
    "banana equivalent dose",
    "science facts",
    "radiation facts",
    "food science",
    "mind blowing facts",
    "shorts facts",
    "did you know",
    "physics facts",
    "science shorts",
    "potassium 40",
    "weird science",
    "amazing facts"
  ],
  "hashtags": [
    "#shorts",
    "#science",
    "#physics",
    "#facts"
  ],
  "sources": [
    "https://www.sciencefocus.com/science/how-many-bananas-would-i-need-to-eat-to-become-radioactive/",
    "https://en.wikipedia.org/wiki/Banana_equivalent_dose"
  ],
  "thumbnail_text": "BANANAS ARE RADIOACTIVE"
}
