{
  "id": "2026-11-10-sharks-older-than-trees",
  "topic": "animals",
  "title": "Sharks Are Older Than Trees (and the Dinosaurs)",
  "scenes": [
    {
      "text": "Sharks are older than trees.",
      "keywords": "shark swimming underwater ocean"
    },
    {
      "text": "Sharks have swum the oceans for more than four hundred million years. The first true trees only showed up around three hundred and eighty-five million years ago.",
      "keywords": "ancient forest ferns mist"
    },
    {
      "text": "So sharks were already hunting while the tallest plant on land was a moss a few centimetres high.",
      "keywords": "moss closeup green rocks"
    },
    {
      "text": "They're older than the dinosaurs too. The dinosaurs lasted about a hundred and sixty-five million years. Sharks have done two and a half times that.",
      "keywords": "dinosaur skeleton museum"
    },
    {
      "text": "They lasted because the design just works. A fast body, a light skeleton of cartilage, and teeth that keep replacing themselves.",
      "keywords": "shark teeth jaws closeup"
    },
    {
      "text": "Every shark alive is the result of four hundred million years of testing. Which animal do you think is older than it looks?",
      "keywords": "great white shark ocean surface"
    }
  ],
  "description": "Sharks are older than trees.\nSharks have existed for more than 400 million years, while the first true trees appeared around 385 million years ago. They also outdate the dinosaurs, whose entire reign lasted about 165 million years.\nTheir design simply works: a streamlined body, a light cartilage skeleton and endlessly replaced teeth.\nWhich animal do you think is older than it looks?",
  "tags": [
    "sharks older than trees",
    "shark facts",
    "animal facts",
    "evolution facts",
    "ocean facts",
    "mind blowing facts",
    "shorts facts",
    "did you know",
    "animals shorts",
    "prehistoric animals",
    "marine life",
    "nature facts",
    "amazing facts"
  ],
  "hashtags": [
    "#shorts",
    "#animals",
    "#sharks",
    "#facts"
  ],
  "sources": [
    "https://www.discoverwildlife.com/prehistoric-life/are-sharks-older-than-trees",
    "https://www.earthdate.org/episodes/shark-planet"
  ],
  "thumbnail_text": "SHARKS ARE OLDER THAN TREES"
}
