{
  "id": "2026-11-18-jellyfish-that-ages-backwards",
  "topic": "animals",
  "title": "This Jellyfish Can Age Backwards and Restart Its Life",
  "scenes": [
    {
      "text": "There's a jellyfish that ages backwards. It never dies of old age.",
      "keywords": "small jellyfish glowing underwater"
    },
    {
      "text": "It's called the immortal jellyfish, and it's smaller than your little fingernail.",
      "keywords": "tiny jellyfish macro closeup"
    },
    {
      "text": "When it's hurt, starving or old, it sinks to the sea floor and melts its adult body into a blob.",
      "keywords": "jellyfish sinking ocean floor"
    },
    {
      "text": "That blob becomes a polyp, the baby stage, and buds off brand new jellyfish. A butterfly turning back into a caterpillar.",
      "keywords": "coral polyps reef closeup"
    },
    {
      "text": "It works because its cells can switch jobs, a muscle cell turning into a nerve cell, which almost no other animal can do.",
      "keywords": "cells dividing microscope"
    },
    {
      "text": "In twenty twenty-two, scientists read its genome and found twice as many copies of the genes that repair DNA. Would you restart your life if you could?",
      "keywords": "dna helix laboratory scientist"
    }
  ],
  "description": "There's a jellyfish that can age backwards, and it never has to die of old age.\nTurritopsis dohrnii, the immortal jellyfish, is less than 5 mm across. When injured, starving or ageing, it reverts its adult body into a polyp, the juvenile stage, and starts its life cycle again. Its cells can transform into other cell types, a process called transdifferentiation.\nA 2022 genome study found it carries twice as many copies of DNA-repair genes as its mortal cousin.\nWould you restart your life if you could?",
  "tags": [
    "immortal jellyfish",
    "turritopsis dohrnii",
    "animal facts",
    "jellyfish facts",
    "ocean animals",
    "immortal animals",
    "biology facts",
    "mind blowing facts",
    "shorts facts",
    "did you know",
    "sea creatures",
    "amazing animals",
    "nature facts"
  ],
  "hashtags": [
    "#shorts",
    "#animals",
    "#jellyfish",
    "#facts"
  ],
  "sources": [
    "https://phys.org/news/2022-08-genetic-immortal-jellyfish-longevity.html",
    "https://en.wikipedia.org/wiki/Turritopsis_dohrnii"
  ],
  "thumbnail_text": "THE JELLYFISH THAT AGES BACKWARDS"
}
