{
  "id": "2026-11-09-rhymes-feel-more-true",
  "topic": "psychology",
  "title": "Your Brain Believes a Sentence More If It Rhymes",
  "scenes": [
    {
      "text": "Your brain believes a sentence more if it rhymes.",
      "keywords": "person thinking closeup eyes"
    },
    {
      "text": "In two thousand, psychologists showed people old sayings. Half heard the rhyming version. What sobriety conceals, alcohol reveals.",
      "keywords": "open book pages reading"
    },
    {
      "text": "The other half heard the exact same idea without the rhyme. What sobriety conceals, alcohol unmasks.",
      "keywords": "people talking conversation cafe"
    },
    {
      "text": "Same meaning. But people rated the rhyming version as more accurate. More true. And they had no idea the rhyme was doing it.",
      "keywords": "survey checklist pen paper"
    },
    {
      "text": "It happens because rhymes are easier for your brain to process, and your brain mistakes that easy feeling for truth.",
      "keywords": "brain neurons glowing animation"
    },
    {
      "text": "Advertisers and lawyers know this. So the next time a slogan sounds right, ask yourself if it just sounds nice. Which rhyme fooled you?",
      "keywords": "billboard advertisement city street"
    }
  ],
  "description": "Your brain believes a sentence more if it rhymes.\nIn a 2000 study published in Psychological Science, people rated rhyming sayings such as What sobriety conceals, alcohol reveals as more accurate than versions with identical meaning that did not rhyme.\nResearchers call it the rhyme-as-reason effect: rhymes are easier to process, and the brain mistakes that fluency for truth.\nWhich rhyming slogan has fooled you?",
  "tags": [
    "rhyme as reason effect",
    "psychology facts",
    "cognitive bias",
    "brain facts",
    "persuasion psychology",
    "mind blowing facts",
    "shorts facts",
    "did you know",
    "psychology shorts",
    "human behavior",
    "advertising tricks",
    "mind tricks",
    "amazing facts"
  ],
  "hashtags": [
    "#shorts",
    "#psychology",
    "#brain",
    "#facts"
  ],
  "sources": [
    "https://en.wikipedia.org/wiki/Rhyme-as-reason_effect",
    "https://bigthink.com/neuropsych/rhyme-as-reason/"
  ],
  "thumbnail_text": "RHYMES FEEL TRUE. HERE'S WHY"
}
