{
  "id": "2026-10-16-sharks-older-than-trees",
  "topic": "animals",
  "priority": 8,
  "title": "Sharks Are Older Than Trees (and the Dinosaurs)",
  "scenes": [
    {
      "text": "Sharks are older than trees.",
      "keywords": "shark swimming ocean"
    },
    {
      "text": "Sharks have been swimming in the oceans for about 450 million years.",
      "keywords": "shark underwater deep blue"
    },
    {
      "text": "The first real trees didn't appear until around 390 million years ago.",
      "keywords": "ancient forest ferns"
    },
    {
      "text": "So for roughly 60 million years, sharks ruled the seas while the land had nothing taller than moss.",
      "keywords": "moss rocks macro"
    },
    {
      "text": "They're older than the dinosaurs, older than Saturn's rings, and they survived all five mass extinctions.",
      "keywords": "shark close up teeth"
    },
    {
      "text": "Trees are the newcomers. Sharks were here first.",
      "keywords": "shark silhouette sunlight water"
    }
  ],
  "description": "Sharks have existed for about 450 million years. Trees only showed up around 390 million years ago.\nThat makes sharks older than trees, older than dinosaurs, and survivors of every mass extinction.\nWhich animal do you think is next on the list?",
  "tags": [
    "sharks",
    "shark facts",
    "animal facts",
    "older than trees",
    "mind blowing facts",
    "did you know",
    "ocean facts",
    "prehistoric animals",
    "nature facts",
    "facts shorts",
    "science facts",
    "wildlife"
  ],
  "hashtags": [
    "#shorts",
    "#sharks",
    "#animals",
    "#facts"
  ],
  "sources": [
    "https://www.discoverwildlife.com/prehistoric-life/are-sharks-older-than-trees"
  ],
  "thumbnail_text": "OLDER THAN TREES"
}
