{
  "id": "2026-11-04-your-brain-cannot-feel-pain",
  "topic": "human body",
  "title": "Your Brain Can't Feel Pain (That's Why Surgery Can Be Awake)",
  "scenes": [
    {
      "text": "Your brain cannot feel pain. Not even when a surgeon cuts into it.",
      "keywords": "brain scan mri hospital"
    },
    {
      "text": "In awake brain surgery, the patient talks, counts and moves while the surgeon works inside their head.",
      "keywords": "surgeons operating room"
    },
    {
      "text": "They may feel pressure, maybe some pulling. But no pain from the brain itself.",
      "keywords": "patient hospital bed calm"
    },
    {
      "text": "Surgeons do it on purpose, so they can map which spots control speech or movement, and steer around them.",
      "keywords": "doctor pointing brain model"
    },
    {
      "text": "It works because the brain has no pain receptors. It reads pain signals from everywhere else, but it has none of its own.",
      "keywords": "neurons glowing network"
    },
    {
      "text": "So where do headaches come from? Blood vessels, muscles and the membranes around your brain. Never the brain itself.",
      "keywords": "person headache rubbing temples"
    }
  ],
  "description": "Your brain cannot feel pain, which is why some brain surgery is done while the patient is awake, talking and counting.\nThe brain has no pain receptors of its own. It processes pain signals from the rest of the body, but cutting into it doesn't hurt. Patients may feel pressure or pulling, but the scalp is numbed.\nHeadaches come from blood vessels, muscles and the membranes around the brain, not the brain itself.\nWould you stay awake for brain surgery?",
  "tags": [
    "brain facts",
    "human body facts",
    "awake brain surgery",
    "brain no pain",
    "mind blowing facts",
    "body shorts",
    "did you know",
    "facts shorts",
    "science facts",
    "anatomy",
    "neuroscience",
    "medical facts"
  ],
  "hashtags": [
    "#shorts",
    "#humanbody",
    "#brain",
    "#facts"
  ],
  "sources": [
    "https://brainfacts.org/thinking-sensing-and-behaving/pain/2021/why-doesnt-the-brain-have-nociceptors-020321",
    "https://www.mayoclinic.org/tests-procedures/awake-brain-surgery/home/ovc-20247843"
  ],
  "thumbnail_text": "YOUR BRAIN CAN'T FEEL PAIN",
  "priority": 4
}